{
  "$schema": "https://json-schema.org/draft/2020-12/schema",
  "title": "Dravux accessibility audit report",
  "$comment": "Cross-item uniqueness and subset invariants are enforced by scripts/dravux_contract.py; all representable structural and verdict invariants are also published here.",
  "type": "object",
  "additionalProperties": false,
  "required": [
    "contract_version",
    "audit_id",
    "target",
    "scope",
    "automated_result",
    "final_status",
    "findings",
    "errors",
    "evidence_log",
    "run"
  ],
  "properties": {
    "$schema": {"type": "string", "minLength": 1, "pattern": "^[^\\u0000-\\u001f\\u007f\\u0085\\u2028\\u2029]*[^\\s\\u0000-\\u001f\\u007f\\u0085\\u2028\\u2029][^\\u0000-\\u001f\\u007f\\u0085\\u2028\\u2029]*$"},
    "contract_version": {"type": "string", "const": "0.2.0"},
    "audit_id": {"type": "string", "minLength": 1, "pattern": "^DRV-[A-Z0-9][A-Z0-9._-]*$"},
    "target": {"$ref": "#/$defs/target"},
    "scope": {"$ref": "#/$defs/scope"},
    "automated_result": {"enum": ["PASS", "FAIL", "ERROR"]},
    "final_status": {"enum": ["VERIFIED PASS", "VERIFIED FAIL", "INCOMPLETE", "NOT APPLICABLE"]},
    "findings": {
      "type": "array",
      "items": {"$ref": "finding.schema.json"}
    },
    "errors": {
      "type": "array",
      "items": {"$ref": "#/$defs/error"}
    },
    "evidence_log": {
      "type": "array",
      "minItems": 1,
      "items": {"$ref": "#/$defs/evidence"}
    },
    "run": {"$ref": "#/$defs/run"}
  },
  "allOf": [
    {
      "if": {"properties": {"automated_result": {"const": "PASS"}}},
      "then": {"properties": {"errors": {"maxItems": 0}}}
    },
    {
      "if": {"properties": {"automated_result": {"const": "ERROR"}}},
      "then": {
        "properties": {
          "errors": {"minItems": 1},
          "final_status": {"enum": ["VERIFIED FAIL", "INCOMPLETE", "NOT APPLICABLE"]}
        }
      }
    },
    {
      "if": {"properties": {"automated_result": {"const": "FAIL"}}},
      "then": {
        "properties": {
          "findings": {"contains": {"properties": {"classification": {"const": "NORMATIVE"}}}},
          "final_status": {"enum": ["VERIFIED FAIL", "INCOMPLETE"]}
        }
      }
    },
    {
      "if": {
        "required": ["automated_result", "final_status"],
        "properties": {
          "automated_result": {"const": "PASS"},
          "final_status": {"not": {"const": "VERIFIED FAIL"}}
        }
      },
      "then": {
        "properties": {
          "findings": {
            "not": {
              "contains": {
                "required": ["classification"],
                "properties": {"classification": {"const": "NORMATIVE"}}
              }
            }
          }
        }
      }
    },
    {
      "if": {"properties": {"final_status": {"const": "VERIFIED FAIL"}}},
      "then": {
        "properties": {
          "findings": {"contains": {"properties": {"classification": {"const": "NORMATIVE"}, "status": {"const": "OPEN"}}}}
        }
      }
    },
    {
      "if": {"properties": {"final_status": {"const": "VERIFIED PASS"}}},
      "then": {"properties": {"automated_result": {"const": "PASS"}, "errors": {"maxItems": 0}, "findings": {"maxItems": 0}, "scope": {"properties": {"required_manual_checks": {"minItems": 1}, "manual_checks_completed": {"minItems": 1}}}}}
    },
    {
      "if": {"properties": {"final_status": {"const": "NOT APPLICABLE"}}},
      "then": {
        "properties": {
          "automated_result": {"const": "ERROR"},
          "findings": {"maxItems": 0},
          "scope": {"properties": {"applicability_reason": {"type": "string", "minLength": 1, "pattern": "^[^\\u0000-\\u001f\\u007f\\u0085\\u2028\\u2029]*[^\\s\\u0000-\\u001f\\u007f\\u0085\\u2028\\u2029][^\\u0000-\\u001f\\u007f\\u0085\\u2028\\u2029]*$"}}},
          "errors": {
            "minItems": 1,
            "items": {"allOf": [{"$ref": "#/$defs/error"}, {"properties": {"code": {"const": "NOT_APPLICABLE"}}}]}
          }
        }
      }
    },
    {
      "if": {
        "properties": {
          "final_status": {"const": "VERIFIED FAIL"},
          "automated_result": {"enum": ["PASS", "ERROR"]}
        }
      },
      "then": {
        "properties": {
          "scope": {"properties": {"manual_checks_completed": {"minItems": 1}}},
          "findings": {
            "contains": {
              "properties": {
                "classification": {"const": "NORMATIVE"},
                "manual_review_required": {"const": true},
                "evidence": {"contains": {"properties": {"type": {"const": "MANUAL_OBSERVATION"}}}}
              }
            }
          }
        }
      }
    },
    {
      "if": {"properties": {"target": {"properties": {"input_type": {"const": "UNSUPPORTED"}}}}},
      "then": {
        "properties": {
          "automated_result": {"const": "ERROR"},
          "final_status": {"const": "INCOMPLETE"}
        }
      }
    }
  ],
  "$defs": {
    "inputType": {
      "enum": ["WEBSITE", "SOURCE_CODE", "MARKDOWN", "STRUCTURED_CONTENT", "SVG", "IMAGE_METADATA", "PDF", "SCREENSHOT", "GITHUB_ARTIFACT", "UNSUPPORTED"]
    },
    "target": {
      "type": "object",
      "additionalProperties": false,
      "required": ["name", "state", "location", "input_type"],
      "properties": {
        "name": {"type": "string", "minLength": 1, "pattern": "^[^\\u0000-\\u001f\\u007f\\u0085\\u2028\\u2029]*[^\\s\\u0000-\\u001f\\u007f\\u0085\\u2028\\u2029][^\\u0000-\\u001f\\u007f\\u0085\\u2028\\u2029]*$"},
        "state": {"type": "string", "minLength": 1, "pattern": "^[^\\u0000-\\u001f\\u007f\\u0085\\u2028\\u2029]*[^\\s\\u0000-\\u001f\\u007f\\u0085\\u2028\\u2029][^\\u0000-\\u001f\\u007f\\u0085\\u2028\\u2029]*$"},
        "location": {"type": "string", "minLength": 1, "pattern": "^[^\\u0000-\\u001f\\u007f\\u0085\\u2028\\u2029]*[^\\s\\u0000-\\u001f\\u007f\\u0085\\u2028\\u2029][^\\u0000-\\u001f\\u007f\\u0085\\u2028\\u2029]*$"},
        "input_type": {"$ref": "#/$defs/inputType"}
      }
    },
    "scope": {
      "type": "object",
      "additionalProperties": false,
      "required": ["included", "excluded", "required_manual_checks", "manual_checks_completed", "applicability_reason"],
      "properties": {
        "included": {"type": "array", "minItems": 1, "items": {"type": "string", "minLength": 1, "pattern": "^[^\\u0000-\\u001f\\u007f\\u0085\\u2028\\u2029]*[^\\s\\u0000-\\u001f\\u007f\\u0085\\u2028\\u2029][^\\u0000-\\u001f\\u007f\\u0085\\u2028\\u2029]*$"}},
        "excluded": {"type": "array", "items": {"type": "string", "minLength": 1, "pattern": "^[^\\u0000-\\u001f\\u007f\\u0085\\u2028\\u2029]*[^\\s\\u0000-\\u001f\\u007f\\u0085\\u2028\\u2029][^\\u0000-\\u001f\\u007f\\u0085\\u2028\\u2029]*$"}},
        "required_manual_checks": {"type": "array", "uniqueItems": true, "items": {"type": "string", "minLength": 1, "pattern": "^[^\\u0000-\\u001f\\u007f\\u0085\\u2028\\u2029]*[^\\s\\u0000-\\u001f\\u007f\\u0085\\u2028\\u2029][^\\u0000-\\u001f\\u007f\\u0085\\u2028\\u2029]*$"}},
        "manual_checks_completed": {"type": "array", "uniqueItems": true, "items": {"type": "string", "minLength": 1, "pattern": "^[^\\u0000-\\u001f\\u007f\\u0085\\u2028\\u2029]*[^\\s\\u0000-\\u001f\\u007f\\u0085\\u2028\\u2029][^\\u0000-\\u001f\\u007f\\u0085\\u2028\\u2029]*$"}},
        "applicability_reason": {"type": ["string", "null"], "minLength": 1, "pattern": "^[^\\u0000-\\u001f\\u007f\\u0085\\u2028\\u2029]*[^\\s\\u0000-\\u001f\\u007f\\u0085\\u2028\\u2029][^\\u0000-\\u001f\\u007f\\u0085\\u2028\\u2029]*$"}
      }
    },
    "error": {
      "type": "object",
      "additionalProperties": false,
      "required": ["code", "message", "stage"],
      "properties": {
        "code": {"type": "string", "minLength": 1, "pattern": "^[^\\u0000-\\u001f\\u007f\\u0085\\u2028\\u2029]*[^\\s\\u0000-\\u001f\\u007f\\u0085\\u2028\\u2029][^\\u0000-\\u001f\\u007f\\u0085\\u2028\\u2029]*$"},
        "message": {"type": "string", "minLength": 1, "pattern": "^[^\\u0000-\\u001f\\u007f\\u0085\\u2028\\u2029]*[^\\s\\u0000-\\u001f\\u007f\\u0085\\u2028\\u2029][^\\u0000-\\u001f\\u007f\\u0085\\u2028\\u2029]*$"},
        "stage": {"type": "string", "minLength": 1, "pattern": "^[^\\u0000-\\u001f\\u007f\\u0085\\u2028\\u2029]*[^\\s\\u0000-\\u001f\\u007f\\u0085\\u2028\\u2029][^\\u0000-\\u001f\\u007f\\u0085\\u2028\\u2029]*$"}
      }
    },
    "evidence": {
      "type": "object",
      "additionalProperties": false,
      "required": ["type", "description", "locator"],
      "properties": {
        "type": {"enum": ["DOM", "SOURCE", "SCREENSHOT", "TOOL_OUTPUT", "COMMAND_OUTPUT", "MANUAL_OBSERVATION", "DOCUMENT_STRUCTURE"]},
        "description": {"type": "string", "minLength": 1, "pattern": "^[^\\u0000-\\u001f\\u007f\\u0085\\u2028\\u2029]*[^\\s\\u0000-\\u001f\\u007f\\u0085\\u2028\\u2029][^\\u0000-\\u001f\\u007f\\u0085\\u2028\\u2029]*$"},
        "locator": {"type": "string", "minLength": 1, "pattern": "^[^\\u0000-\\u001f\\u007f\\u0085\\u2028\\u2029]*[^\\s\\u0000-\\u001f\\u007f\\u0085\\u2028\\u2029][^\\u0000-\\u001f\\u007f\\u0085\\u2028\\u2029]*$"},
        "manual_check_id": {"type": "string", "minLength": 1, "pattern": "^[^\\u0000-\\u001f\\u007f\\u0085\\u2028\\u2029]*[^\\s\\u0000-\\u001f\\u007f\\u0085\\u2028\\u2029][^\\u0000-\\u001f\\u007f\\u0085\\u2028\\u2029]*$"}
      },
      "allOf": [{"if": {"properties": {"type": {"const": "MANUAL_OBSERVATION"}}}, "then": {"required": ["manual_check_id"]}, "else": {"not": {"required": ["manual_check_id"]}}}]
    },
    "run": {
      "type": "object",
      "additionalProperties": false,
      "required": ["started_at", "completed_at", "tooling", "environment"],
      "properties": {
        "started_at": {"type": "string", "format": "date-time"},
        "completed_at": {"type": "string", "format": "date-time"},
        "tooling": {"type": "array", "minItems": 1, "items": {"type": "string", "minLength": 1, "pattern": "^[^\\u0000-\\u001f\\u007f\\u0085\\u2028\\u2029]*[^\\s\\u0000-\\u001f\\u007f\\u0085\\u2028\\u2029][^\\u0000-\\u001f\\u007f\\u0085\\u2028\\u2029]*$"}},
        "environment": {"type": "string", "minLength": 1, "pattern": "^[^\\u0000-\\u001f\\u007f\\u0085\\u2028\\u2029]*[^\\s\\u0000-\\u001f\\u007f\\u0085\\u2028\\u2029][^\\u0000-\\u001f\\u007f\\u0085\\u2028\\u2029]*$"}
      }
    }
  }
}
