{
  "$schema": "../../schemas/dravux-report.schema.json",
  "contract_version": "0.2.0",
  "audit_id": "DRV-KNOWN-PASS-001",
  "target": {
    "name": "Synthetic accessible button component",
    "state": "verified fixture",
    "location": "fixtures/passing/known-pass.json",
    "input_type": "SOURCE_CODE"
  },
  "scope": {
    "included": ["button semantics", "contrast", "keyboard activation", "accessible name"],
    "excluded": ["full application flows"],
    "required_manual_checks": ["keyboard", "screen-reader"],
    "manual_checks_completed": ["keyboard", "screen-reader"],
    "applicability_reason": null
  },
  "automated_result": "PASS",
  "final_status": "VERIFIED PASS",
  "findings": [],
  "errors": [],
  "evidence_log": [
    {
      "type": "COMMAND_OUTPUT",
      "description": "All deterministic fixture assertions passed.",
      "locator": "tests/test_contract.py::test_manifest_expectations"
    },
    {
      "type": "MANUAL_OBSERVATION",
      "manual_check_id": "keyboard",
      "description": "Synthetic keyboard and screen-reader checks are recorded complete for this bounded fixture.",
      "locator": "fixture scope.manual_checks_completed"
    },
    {
      "type": "MANUAL_OBSERVATION",
      "manual_check_id": "screen-reader",
      "description": "Synthetic screen-reader checks are recorded complete for this bounded fixture.",
      "locator": "fixture scope.manual_checks_completed"
    }
  ],
  "run": {
    "started_at": "2026-07-16T14:00:00Z",
    "completed_at": "2026-07-16T14:00:01Z",
    "tooling": ["Dravux fixture harness 1.0.2"],
    "environment": "Synthetic offline fixture"
  }
}
